{
  "id": "QUIET_WOODS",
  "tileSize": 64,
  "w": 30,
  "h": 20,
  "tiles": [
    3,
    3,
    3,
    3,
    3,
    1,
    1,
    1,
    1,
    1,
    1,
    1,
    1,
    1,
    1,
    1,
    1,
    1,
    1,
    1,
    1,
    1,
    1,
    1,
    1,
    1,
    1,
    1,
    1,
    1,
    3,
    3,
    3,
    3,
    3,
    1,
    1,
    1,
    1,
    1,
    1,
    1,
    1,
    1,
    1,
    1,
    1,
    1,
    1,
    1,
    1,
    1,
    1,
    1,
    1,
    1,
    1,
    1,
    1,
    1,
    3,
    3,
    3,
    3,
    3,
    1,
    1,
    1,
    1,
    1,
    1,
    1,
    1,
    1,
    1,
    1,
    1,
    1,
    1,
    1,
    1,
    1,
    1,
    1,
    1,
    1,
    1,
    1,
    1,
    1,
    3,
    3,
    3,
    3,
    3,
    1,
    1,
    1,
    1,
    1,
    1,
    1,
    1,
    1,
    1,
    1,
    1,
    1,
    1,
    1,
    1,
    1,
    1,
    1,
    1,
    1,
    1,
    1,
    1,
    1,
    1,
    1,
    1,
    1,
    1,
    1,
    1,
    1,
    1,
    1,
    1,
    1,
    1,
    1,
    1,
    1,
    1,
    1,
    1,
    1,
    1,
    1,
    4,
    4,
    4,
    1,
    1,
    1,
    1,
    1,
    1,
    1,
    1,
    1,
    1,
    1,
    1,
    1,
    1,
    0,
    0,
    0,
    1,
    1,
    1,
    1,
    1,
    1,
    1,
    1,
    1,
    1,
    4,
    4,
    4,
    1,
    1,
    1,
    1,
    1,
    1,
    1,
    1,
    1,
    1,
    1,
    1,
    1,
    1,
    0,
    0,
    0,
    1,
    1,
    1,
    1,
    1,
    1,
    1,
    1,
    1,
    1,
    4,
    4,
    4,
    1,
    1,
    1,
    1,
    1,
    1,
    1,
    1,
    1,
    1,
    1,
    1,
    1,
    1,
    0,
    0,
    0,
    1,
    1,
    1,
    1,
    1,
    1,
    1,
    1,
    1,
    1,
    1,
    1,
    1,
    1,
    1,
    1,
    1,
    1,
    1,
    1,
    1,
    1,
    1,
    1,
    1,
    1,
    1,
    1,
    1,
    1,
    1,
    0,
    0,
    0,
    1,
    1,
    1,
    1,
    1,
    1,
    1,
    1,
    1,
    1,
    1,
    1,
    1,
    1,
    1,
    1,
    1,
    1,
    1,
    1,
    1,
    1,
    1,
    1,
    1,
    1,
    2,
    0,
    0,
    0,
    1,
    1,
    1,
    1,
    1,
    1,
    1,
    1,
    1,
    1,
    1,
    1,
    1,
    1,
    1,
    1,
    1,
    1,
    1,
    1,
    1,
    1,
    1,
    1,
    1,
    1,
    2,
    1,
    1,
    1,
    1,
    1,
    1,
    1,
    1,
    1,
    1,
    1,
    1,
    1,
    1,
    1,
    1,
    1,
    1,
    1,
    1,
    1,
    1,
    1,
    1,
    1,
    1,
    1,
    1,
    1,
    2,
    1,
    1,
    1,
    1,
    1,
    1,
    1,
    1,
    1,
    1,
    1,
    1,
    1,
    1,
    1,
    1,
    1,
    1,
    0,
    0,
    0,
    0,
    0,
    0,
    0,
    1,
    1,
    1,
    1,
    2,
    1,
    1,
    1,
    1,
    1,
    1,
    1,
    1,
    1,
    1,
    1,
    1,
    1,
    1,
    1,
    1,
    1,
    1,
    0,
    0,
    0,
    0,
    0,
    0,
    0,
    1,
    1,
    1,
    1,
    2,
    1,
    1,
    1,
    1,
    1,
    1,
    1,
    1,
    1,
    1,
    1,
    1,
    1,
    1,
    1,
    1,
    1,
    1,
    0,
    0,
    2,
    2,
    2,
    2,
    2,
    2,
    2,
    2,
    2,
    2,
    2,
    2,
    2,
    2,
    2,
    2,
    2,
    2,
    2,
    2,
    2,
    2,
    2,
    1,
    1,
    1,
    1,
    1,
    0,
    0,
    0,
    0,
    0,
    0,
    0,
    1,
    1,
    1,
    1,
    1,
    1,
    1,
    1,
    1,
    1,
    1,
    1,
    1,
    1,
    1,
    1,
    1,
    1,
    1,
    1,
    1,
    1,
    1,
    0,
    0,
    0,
    0,
    5,
    5,
    5,
    1,
    1,
    1,
    1,
    1,
    1,
    1,
    1,
    1,
    1,
    1,
    1,
    1,
    1,
    1,
    1,
    1,
    1,
    1,
    1,
    1,
    1,
    1,
    1,
    1,
    1,
    1,
    5,
    5,
    5,
    1,
    1,
    1,
    1,
    1,
    1,
    1,
    1,
    1,
    1,
    1,
    1,
    1,
    1,
    1,
    1,
    1,
    1,
    1,
    1,
    1,
    1,
    1,
    1,
    1,
    1,
    1,
    5,
    5,
    5,
    1,
    1,
    1,
    1,
    1,
    1,
    1,
    1,
    1,
    1,
    1,
    1,
    1,
    1,
    1,
    1,
    1,
    1,
    1,
    1,
    1,
    1,
    1,
    1,
    1,
    1,
    1,
    1,
    1,
    1,
    1,
    1,
    1,
    1,
    1,
    1,
    1,
    1,
    1,
    1,
    1,
    1,
    1,
    1,
    1,
    1,
    1,
    1,
    1,
    1,
    1,
    1
  ],
  "spawn": {
    "tx": 3,
    "ty": 14
  },
  "objects": [
    {
      "id": "OWL",
      "kind": "CREATURE",
      "tx": 9,
      "ty": 6,
      "size": "tiny",
      "hero": "./heroes/owl-scared.webp",
      "name": "Quiet Owl",
      "stats": {
        "Health": 55,
        "Mood": "Scared",
        "Courage": "Low"
      },
      "r": 1.2,
      "text": [
        "The branches should sing...",
        "But they don\u2019t."
      ]
    },
    {
      "id": "SQUIRREL",
      "kind": "CREATURE",
      "tx": 14,
      "ty": 10,
      "size": "tiny",
      "hero": "./heroes/squirrel-scared.webp",
      "name": "Shy Squirrel",
      "stats": {
        "Health": 45,
        "Mood": "Spooked",
        "Courage": "Very Low"
      },
      "r": 1.2,
      "text": [
        "We don\u2019t chatter when the mist stays."
      ]
    },
    {
      "id": "DEER",
      "kind": "CREATURE",
      "tx": 22,
      "ty": 12,
      "size": "medium",
      "hero": "./heroes/deer-scared.webp",
      "name": "Wary Deer",
      "stats": {
        "Health": 70,
        "Mood": "Wary",
        "Courage": "Low"
      },
      "r": 1.5,
      "text": [
        "Something listens now."
      ]
    },
    {
      "id": "WOOD_1",
      "kind": "RESOURCE",
      "type": "WOOD",
      "tx": 7,
      "ty": 12,
      "amount": 5
    },
    {
      "id": "WOOD_2",
      "kind": "RESOURCE",
      "type": "WOOD",
      "tx": 6,
      "ty": 14,
      "amount": 3
    },
    {
      "id": "WOOD_3",
      "kind": "RESOURCE",
      "type": "WOOD",
      "tx": 16,
      "ty": 14,
      "amount": 4
    },
    {
      "id": "WOOD_4",
      "kind": "RESOURCE",
      "type": "WOOD",
      "tx": 20,
      "ty": 10,
      "amount": 3
    },
    {
      "id": "WOOD_5",
      "kind": "RESOURCE",
      "type": "WOOD",
      "tx": 24,
      "ty": 8,
      "amount": 4
    },
    {
      "id": "WOOD_6",
      "kind": "RESOURCE",
      "type": "WOOD",
      "tx": 15,
      "ty": 8,
      "amount": 5
    },
    {
      "id": "GOLD_1",
      "kind": "RESOURCE",
      "type": "GOLD",
      "tx": 10,
      "ty": 12,
      "amount": 10
    },
    {
      "id": "STONE_1",
      "kind": "RESOURCE",
      "type": "STONE",
      "tx": 18,
      "ty": 8,
      "amount": 4
    }
  ],
  "complete": {
    "type": "TALK_COUNT",
    "count": 2
  },
  "resourceGoals": {
    "WOOD": 5
  },
  "unlocks": [
    "WHISPERING_FOREST"
  ]
}
